{
  "format": "qai.quran.edition",
  "format_version": 1,
  "edition": {
    "slug": "synthetic-rich-reference",
    "name": "Synthetic rich reference edition (non-canonical)",
    "script": "uthmani",
    "riwayah": null,
    "qiraah": null,
    "language": "ar",
    "verse_numbering_scheme": "hafs",
    "unicode_normalization": "nfc",
    "basmala_policy": "per_surah",
    "publisher": null,
    "version": "0.1.0",
    "synthetic": true
  },
  "expected": {
    "surah_count": 6,
    "ayah_count": 24,
    "reference_corpus_id": "synthetic-rich-reference",
    "reference_text_hash": "sha256:6c9e6916a7a04850805f4205bd0993042d338af1a82ddd37972745f3e409bb3a"
  },
  "surahs": [
    {
      "number": 1,
      "name_arabic": "سورة اختبار غنية ١",
      "name_transliteration": "Test-Rich-1",
      "ayah_count": 5,
      "revelation_place": "makki",
      "revelation_order": 1,
      "basmala": "counted_as_first_ayah",
      "ruku_count": 1
    },
    {
      "number": 2,
      "name_arabic": "سورة اختبار غنية ٢",
      "name_transliteration": "Test-Rich-2",
      "ayah_count": 4,
      "revelation_place": "madani",
      "revelation_order": 2,
      "basmala": "unnumbered_header",
      "ruku_count": 1
    },
    {
      "number": 3,
      "name_arabic": "سورة اختبار غنية ٣",
      "name_transliteration": "Test-Rich-3",
      "ayah_count": 4,
      "revelation_place": "makki",
      "revelation_order": 3,
      "basmala": "absent",
      "ruku_count": 1
    },
    {
      "number": 4,
      "name_arabic": "سورة اختبار غنية ٤",
      "name_transliteration": "Test-Rich-4",
      "ayah_count": 4,
      "revelation_place": "madani",
      "revelation_order": 4,
      "basmala": "per_surah",
      "ruku_count": 1
    },
    {
      "number": 5,
      "name_arabic": "سورة اختبار غنية ٥",
      "name_transliteration": "Test-Rich-5",
      "ayah_count": 4,
      "revelation_place": "makki",
      "revelation_order": 5,
      "basmala": "counted_as_first_ayah",
      "ruku_count": 1
    },
    {
      "number": 6,
      "name_arabic": "سورة اختبار غنية ٦",
      "name_transliteration": "Test-Rich-6",
      "ayah_count": 3,
      "revelation_place": "madani",
      "revelation_order": 6,
      "basmala": "absent",
      "ruku_count": 1
    }
  ],
  "ayahs": [
    {
      "surah": 1,
      "ayah": 1,
      "text": "الٓمٓ",
      "juz": 1,
      "hizb": 1,
      "rub": 1,
      "manzil": 1,
      "ruku": 1,
      "page": 1,
      "sajdah": null
    },
    {
      "surah": 1,
      "ayah": 2,
      "text": "أوَيت تَساكُن بِسْمِ ٱللَّهِ ٱلرَّحْمَٰنِ ٱلرَّحِيمِ كن لهُم ثُشأوَ",
      "juz": 1,
      "hizb": 1,
      "rub": 1,
      "manzil": 1,
      "ruku": 1,
      "page": 1,
      "sajdah": null
    },
    {
      "surah": 1,
      "ayah": 3,
      "text": "شُأويَت يت اكَن بَلهمُ مثشُأو أوُۖ وَتَساكُن",
      "juz": 1,
      "hizb": 1,
      "rub": 1,
      "manzil": 1,
      "ruku": 1,
      "page": 2,
      "sajdah": null
    },
    {
      "surah": 1,
      "ayah": 4,
      "text": "ثش ويُت سُاكنَ هَٰذَا لَهم",
      "juz": 1,
      "hizb": 1,
      "rub": 2,
      "manzil": 1,
      "ruku": 2,
      "page": 2,
      "sajdah": null
    },
    {
      "surah": 1,
      "ayah": 5,
      "text": "نَبلهُم هم شأُوۖيُتساَ اكنَبل بلَۖمثشُأو أوُۖتُسا كنبَل لهَمثشُ",
      "juz": 1,
      "hizb": 1,
      "rub": 2,
      "manzil": 1,
      "ruku": 2,
      "page": 2,
      "sajdah": null
    },
    {
      "surah": 2,
      "ayah": 1,
      "text": "كن لهَم ثَشأوُ",
      "juz": 1,
      "hizb": 1,
      "rub": 2,
      "manzil": 1,
      "ruku": 2,
      "page": 3,
      "sajdah": null
    },
    {
      "surah": 2,
      "ayah": 2,
      "text": "شأَو يَتساُ اكنُبل بلُۚ",
      "juz": 1,
      "hizb": 1,
      "rub": 3,
      "manzil": 1,
      "ruku": 3,
      "page": 3,
      "sajdah": null
    },
    {
      "surah": 2,
      "ayah": 3,
      "text": "أو تسُا كُنبلَ",
      "juz": 1,
      "hizb": 1,
      "rub": 3,
      "manzil": 1,
      "ruku": 3,
      "page": 3,
      "sajdah": null
    },
    {
      "surah": 2,
      "ayah": 4,
      "text": "شأَو يَتساُ اكنُبل بلُۚ",
      "juz": 2,
      "hizb": 2,
      "rub": 4,
      "manzil": 2,
      "ruku": 4,
      "page": 4,
      "sajdah": null
    },
    {
      "surah": 3,
      "ayah": 1,
      "text": "ثُشأوَ ويتَسا ساَ نَبل همثُش",
      "juz": 2,
      "hizb": 2,
      "rub": 4,
      "manzil": 2,
      "ruku": 4,
      "page": 4,
      "sajdah": null
    },
    {
      "surah": 3,
      "ayah": 2,
      "text": "مثشُأو أوُ تُسا كنبَل لهَمثشُ ثَش",
      "juz": 2,
      "hizb": 2,
      "rub": 4,
      "manzil": 2,
      "ruku": 4,
      "page": 5,
      "sajdah": null
    },
    {
      "surah": 3,
      "ayah": 3,
      "text": "نبُل هُمثشَ شأوَيت يتَۖكَنبلُ",
      "juz": 2,
      "hizb": 2,
      "rub": 5,
      "manzil": 2,
      "ruku": 5,
      "page": 5,
      "sajdah": null
    },
    {
      "surah": 3,
      "ayah": 4,
      "text": "لهمُثش ثشُ وُيت ساكَنۖمثَشأوُ",
      "juz": 2,
      "hizb": 2,
      "rub": 5,
      "manzil": 2,
      "ruku": 5,
      "page": 5,
      "sajdah": null
    },
    {
      "surah": 4,
      "ayah": 1,
      "text": "أُويتَ تساَكن كنَ لَهم ثشأُو",
      "juz": 2,
      "hizb": 2,
      "rub": 5,
      "manzil": 2,
      "ruku": 5,
      "page": 6,
      "sajdah": null
    },
    {
      "surah": 4,
      "ayah": 2,
      "text": "شأوُيت يتُ اُكن بلهَم مثَشأوُ أَو",
      "juz": 2,
      "hizb": 2,
      "rub": 6,
      "manzil": 2,
      "ruku": 6,
      "page": 6,
      "sajdah": "recommended"
    },
    {
      "surah": 4,
      "ayah": 3,
      "text": "ثشَ وَيت ساكُن ذَٰلِكَ",
      "juz": 2,
      "hizb": 2,
      "rub": 6,
      "manzil": 2,
      "ruku": 6,
      "page": 6,
      "sajdah": null
    },
    {
      "surah": 4,
      "ayah": 4,
      "text": "كن لهُم ثُشأوَۙأوَيت",
      "juz": 3,
      "hizb": 3,
      "rub": 7,
      "manzil": 2,
      "ruku": 7,
      "page": 7,
      "sajdah": null
    },
    {
      "surah": 5,
      "ayah": 1,
      "text": "أوَيت تَساكُن كن لهُم ثُشأوَ",
      "juz": 3,
      "hizb": 3,
      "rub": 7,
      "manzil": 2,
      "ruku": 7,
      "page": 7,
      "sajdah": null
    },
    {
      "surah": 5,
      "ayah": 2,
      "text": "شُأويَت يت اكَن بَلهمُ مثشُأو أوُ",
      "juz": 3,
      "hizb": 3,
      "rub": 7,
      "manzil": 2,
      "ruku": 7,
      "page": 7,
      "sajdah": null
    },
    {
      "surah": 5,
      "ayah": 3,
      "text": "ثش ويُت سُاكنَ هَٰذَا",
      "juz": 3,
      "hizb": 3,
      "rub": 8,
      "manzil": 3,
      "ruku": 8,
      "page": 8,
      "sajdah": null
    },
    {
      "surah": 5,
      "ayah": 4,
      "text": "نَبلهُم هم شأُو يُتساَ اكنَبل بلَ",
      "juz": 3,
      "hizb": 3,
      "rub": 8,
      "manzil": 3,
      "ruku": 8,
      "page": 8,
      "sajdah": null
    },
    {
      "surah": 6,
      "ayah": 1,
      "text": "كن لهَم ثَشأوُۖأو",
      "juz": 3,
      "hizb": 4,
      "rub": 9,
      "manzil": 3,
      "ruku": 9,
      "page": 8,
      "sajdah": null
    },
    {
      "surah": 6,
      "ayah": 2,
      "text": "شأَو يَتساُ اكنُبل بلُ",
      "juz": 3,
      "hizb": 4,
      "rub": 9,
      "manzil": 3,
      "ruku": 9,
      "page": 9,
      "sajdah": null
    },
    {
      "surah": 6,
      "ayah": 3,
      "text": "أو تسُا كُنبلَ ذَٰلِكَ",
      "juz": 3,
      "hizb": 4,
      "rub": 9,
      "manzil": 3,
      "ruku": 9,
      "page": 9,
      "sajdah": null
    }
  ],
  "tokenization": {
    "strategy": "whitespace_preserving",
    "separator_policy": "record_exact"
  }
}
