{
  "format": "qai.quran.edition",
  "format_version": 1,
  "edition": {
    "slug": "test-edition-min",
    "name": "Synthetic test edition v2 (non-canonical, ADR-0101 fallback)",
    "script": "uthmani",
    "riwayah": null,
    "qiraah": null,
    "language": "ar",
    "verse_numbering_scheme": "hafs",
    "unicode_normalization": "nfc",
    "basmala_policy": "per_surah",
    "publisher": null,
    "version": "0.2.0"
  },
  "expected": {
    "surah_count": 5,
    "ayah_count": 14,
    "reference_corpus_id": null,
    "reference_text_hash": null
  },
  "surahs": [
    {
      "number": 1,
      "name_arabic": "سورة تجريبية 1",
      "name_transliteration": "Test-1",
      "ayah_count": 3,
      "revelation_place": "makki",
      "revelation_order": 1,
      "basmala": "counted_as_first_ayah",
      "ruku_count": 1
    },
    {
      "number": 2,
      "name_arabic": "سورة تجريبية 2",
      "name_transliteration": "Test-2",
      "ayah_count": 2,
      "revelation_place": "madani",
      "revelation_order": 2,
      "basmala": "unnumbered_header",
      "ruku_count": 1
    },
    {
      "number": 3,
      "name_arabic": "سورة تجريبية 3",
      "name_transliteration": "Test-3",
      "ayah_count": 4,
      "revelation_place": "makki",
      "revelation_order": 3,
      "basmala": "absent",
      "ruku_count": 1
    },
    {
      "number": 4,
      "name_arabic": "سورة تجريبية 4",
      "name_transliteration": "Test-4",
      "ayah_count": 2,
      "revelation_place": "madani",
      "revelation_order": 4,
      "basmala": "per_surah",
      "ruku_count": 1
    },
    {
      "number": 5,
      "name_arabic": "سورة تجريبية 5",
      "name_transliteration": "Test-5",
      "ayah_count": 3,
      "revelation_place": "makki",
      "revelation_order": 5,
      "basmala": "counted_as_first_ayah",
      "ruku_count": 1
    }
  ],
  "ayahs": [
    {
      "surah": 1,
      "ayah": 1,
      "text": "أوَيت تَساكُن كن لهُم ثُشأوَ ب",
      "juz": 1,
      "hizb": 1,
      "rub": 1,
      "manzil": 1,
      "ruku": 1,
      "page": 1,
      "sajdah": null
    },
    {
      "surah": 1,
      "ayah": 2,
      "text": "شُأويَت يت اكَن بَلهمُ مثشُأو أوُ",
      "juz": 1,
      "hizb": 1,
      "rub": 1,
      "manzil": 1,
      "ruku": 1,
      "page": 1,
      "sajdah": null
    },
    {
      "surah": 1,
      "ayah": 3,
      "text": "ثش ويُت سُاكنَ",
      "juz": 1,
      "hizb": 1,
      "rub": 2,
      "manzil": 1,
      "ruku": 2,
      "page": 1,
      "sajdah": null
    },
    {
      "surah": 2,
      "ayah": 1,
      "text": "نَبلهُم هم شأُو يُتساَ اكنَبل بلَ",
      "juz": 1,
      "hizb": 1,
      "rub": 2,
      "manzil": 1,
      "ruku": 2,
      "page": 2,
      "sajdah": null
    },
    {
      "surah": 2,
      "ayah": 2,
      "text": "كن لهَم ثَشأوُ",
      "juz": 1,
      "hizb": 1,
      "rub": 3,
      "manzil": 1,
      "ruku": 3,
      "page": 2,
      "sajdah": null
    },
    {
      "surah": 3,
      "ayah": 1,
      "text": "أو تسُا كُنبلَ",
      "juz": 1,
      "hizb": 1,
      "rub": 3,
      "manzil": 1,
      "ruku": 3,
      "page": 2,
      "sajdah": null
    },
    {
      "surah": 3,
      "ayah": 2,
      "text": "شأَو يَتساُ اكنُبل بلُ",
      "juz": 1,
      "hizb": 1,
      "rub": 4,
      "manzil": 1,
      "ruku": 4,
      "page": 3,
      "sajdah": null
    },
    {
      "surah": 3,
      "ayah": 3,
      "text": "ثُشأوَ ويتَسا ساَ نَبل همثُش",
      "juz": 1,
      "hizb": 1,
      "rub": 4,
      "manzil": 1,
      "ruku": 4,
      "page": 3,
      "sajdah": null
    },
    {
      "surah": 3,
      "ayah": 4,
      "text": "مثشُأو أوُ تُسا كنبَل لهَمثشُ ثَش",
      "juz": 2,
      "hizb": 2,
      "rub": 5,
      "manzil": 2,
      "ruku": 5,
      "page": 3,
      "sajdah": null
    },
    {
      "surah": 4,
      "ayah": 1,
      "text": "نبُل هُمثشَ شأوَيت يتَ",
      "juz": 2,
      "hizb": 2,
      "rub": 5,
      "manzil": 2,
      "ruku": 5,
      "page": 4,
      "sajdah": null
    },
    {
      "surah": 4,
      "ayah": 2,
      "text": "كَنبلُ لهمُثش ثشُ وُيت ساكَن",
      "juz": 2,
      "hizb": 2,
      "rub": 6,
      "manzil": 2,
      "ruku": 6,
      "page": 4,
      "sajdah": "recommended"
    },
    {
      "surah": 5,
      "ayah": 1,
      "text": "أُويتَ تساَكن كنَ لَهم ثشأُو",
      "juz": 2,
      "hizb": 2,
      "rub": 6,
      "manzil": 2,
      "ruku": 6,
      "page": 4,
      "sajdah": null
    },
    {
      "surah": 5,
      "ayah": 2,
      "text": "شأوُيت يتُ اُكن بلهَم مثَشأوُ أَو",
      "juz": 2,
      "hizb": 2,
      "rub": 7,
      "manzil": 2,
      "ruku": 7,
      "page": 5,
      "sajdah": null
    },
    {
      "surah": 5,
      "ayah": 3,
      "text": "ثشَ وَيت ساكُن",
      "juz": 2,
      "hizb": 2,
      "rub": 7,
      "manzil": 2,
      "ruku": 7,
      "page": 5,
      "sajdah": null
    }
  ],
  "tokenization": {
    "strategy": "whitespace_preserving",
    "separator_policy": "record_exact"
  }
}
